{
  "url": "https://url:%20https://www.mckinsey.com/~/media/mckinsey/industries/financial%20services/our%20insights/the%20future%20of%20ai%20in%20the%20insurance%20industry/the-future-of-ai-in-the-insurance-industry_final2.pdf",
  "title": "https://url:%20https://www.mckinsey.com/~/media/mckinsey/industries/financial%20services/our%20insights/the%20future%20of%20ai%20in%20the%20insurance%20industry/the-future-of-ai-in-the-insurance-industry_final2.pdf",
  "source": "",
  "date": "",
  "time": "all",
  "role": "professional",
  "industry": "cross-bfsi",
  "topic": "technology-and-data-ai",
  "use_cases": "audit-support",
  "agentic_capabilities": "monitoring",
  "content_type": "article",
  "jurisdiction": "global"
}
